{
  "id": "kevin-garnett-cain",
  "series": "court-covenant",
  "type": "villain",
  "cardMode": "player-figure",
  "isAlternate": false,
  "alternateOf": null,
  "opposingPairing": "tim-bezalel",
  "player": {
    "name": "Kevin Garnett",
    "displayName": "Kevin Garnett",
    "poseFileId": "kevin-garnett",
    "era": "2000s",
    "jerseyColors": {
      "primary": {
        "base": "white",
        "accent": "blue"
      },
      "secondary": {
        "base": "blue",
        "accent": "white"
      }
    },
    "signatureMoves": [],
    "physicalDescription": "6'11\" power forward/center, fiercely intense competitor. Known for his intensity, trash-talking, and versatility. Defensive stalwart with a unique blend of skill and passion.",
    "archetype": "Kevin Garnett"
  },
  "figure": {
    "name": "Cain",
    "displayName": "Cain",
    "poseFileId": "cain",
    "attribute": "Agricultural Tools",
    "attributeDescription": "A simple hoe or sickle, representative of his work as a farmer, often stained with earth.",
    "visualStyle": "Realist painting style with earthy tones and strong chiaroscuro.",
    "clothing": "Roughspun tunic of undyed wool or animal hide, secured with a simple leather belt. Barefoot or with roughly made sandals.",
    "physicalDescription": "A muscular, rugged man with weathered skin and a determined, somewhat resentful gaze. Clothed in rough-hewn garments of animal hide. His hands are calloused and strong from working the land.",
    "anatomyNote": "two arms only",
    "archetype": "Cain"
  },
  "connection": {
    "thematic": "Both burned with a competitive fire that could not stand being second",
    "narrative": "God told Cain to master the fire crouching at the door. KG never put it out. He aimed it. Anything is possible.",
    "relationship": "Intensity with no off-switch",
    "scripture": {
      "ref": "Genesis 4:7",
      "hebrew": "הֲלוֹא אִם־תֵּיטִיב שְׂאֵת וְאִם לֹא תֵיטִיב לַפֶּתַח חַטָּאת רֹבֵץ וְאֵלֶיךָ תְּשׁוּקָתוֹ וְאַתָּה תִּמְשָׁל־בּוֹ׃",
      "english": "If thou doest well, shall it not be lifted up? and if thou doest not well, sin coucheth at the door; and unto thee is its desire, but thou mayest rule over it.’"
    },
    "receipt": "2004 MVP; 2008 Defensive Player of the Year and champion"
  },
  "interactions": [
    {
      "id": "back-to-back",
      "description": "Kevin Garnett and Cain standing back-to-back, facing outward with confidence"
    },
    {
      "id": "side-by-side",
      "description": "Kevin Garnett and Cain standing together as equals"
    }
  ],
  "defaultInteraction": "back-to-back",
  "cardVariants": [
    "thunder-lightning-dark",
    "beam-team-shadow",
    "metal-universe-dark"
  ],
  "priority": 99,
  "status": "active"
}
