{
  "id": "jordan-moses",
  "series": "court-covenant",
  "type": "hero",
  "cardMode": "player-figure",
  "player": {
    "name": "Michael Jordan",
    "displayName": "MJ",
    "poseFileId": "jordan",
    "era": "1990s",
    "jerseyColors": {
      "primary": {
        "base": "red",
        "accent": "white"
      },
      "secondary": {
        "base": "white",
        "accent": "red"
      }
    },
    "signatureMoves": [
      "fadeaway jumper",
      "flying dunk",
      "tongue out drive"
    ],
    "physicalDescription": "athletic build, shaved head, intense focused expression",
    "archetype": "The GOAT, ultimate competitor, clutch performer"
  },
  "figure": {
    "name": "Moses",
    "displayName": "Moses",
    "poseFileId": "moses",
    "attribute": "staff of power",
    "attributeDescription": "wooden shepherd's staff crackling with divine energy, the staff that parted the Red Sea",
    "visualStyle": "commanding biblical prophet, ancient Israelite",
    "clothing": "simple linen robes in earth tones, worn sandals, head covering",
    "physicalDescription": "POWERFUL and VIGOROUS despite his age, muscular arms, commanding presence, long white flowing beard, deeply weathered sun-darkened skin, piercing intense eyes burning with divine authority",
    "anatomyNote": "two arms only, one holding staff",
    "archetype": "The Lawgiver, led his people through the wilderness"
  },
  "connection": {
    "thematic": "Both led their people through impossible odds to the promised land",
    "narrative": "Moses parted the Red Sea. MJ parted defenders. Same energy.",
    "relationship": "Leaders who demanded excellence and delivered miracles",
    "scripture": {
      "ref": "Exodus 14:21",
      "hebrew": "וַיֵּט מֹשֶׁה אֶת־יָדוֹ עַל־הַיָּם וַיּוֹלֶךְ יְהוָה אֶת־הַיָּם בְּרוּחַ קָדִים עַזָּה כָּל־הַלַּיְלָה וַיָּשֶׂם אֶת־הַיָּם לֶחָרָבָה וַיִּבָּקְעוּ הַמָּיִם׃",
      "english": "And Moses stretched out his hand over the sea; and the LORD caused the sea to go back by a strong east wind all the night, and made the sea dry land, and the waters were divided."
    },
    "receipt": "6 Finals, 6 titles, 6 Finals MVPs"
  },
  "interactions": [
    {
      "id": "back-to-back",
      "description": "Standing back-to-back, arms crossed, looking outward with confidence"
    },
    {
      "id": "high-five",
      "description": "Dynamic high-five mid-air, energy crackling between their hands"
    },
    {
      "id": "parting-defense",
      "description": "Jordan flying over a parting crowd while Moses raises his staff"
    }
  ],
  "defaultInteraction": "back-to-back",
  "cardVariants": [
    "thunder-lightning",
    "beam-team",
    "metal-universe"
  ],
  "priority": 1,
  "status": "active"
}
