{
  "id": "kobe-joshua",
  "series": "court-covenant",
  "type": "hero",
  "cardMode": "player-figure",
  "player": {
    "name": "Kobe Bryant",
    "displayName": "Mamba",
    "poseFileId": "kobe",
    "era": "2000s",
    "jerseyColors": {
      "primary": {
        "base": "purple",
        "accent": "gold"
      },
      "secondary": {
        "base": "gold",
        "accent": "purple"
      }
    },
    "signatureMoves": [
      "fadeaway jumper",
      "footwork in the post",
      "clutch dagger"
    ],
    "physicalDescription": "athletic build, shaved head, intense killer instinct in eyes",
    "archetype": "The Black Mamba, relentless work ethic, succeeded the GOAT"
  },
  "figure": {
    "name": "Joshua",
    "displayName": "Joshua",
    "poseFileId": "joshua",
    "attribute": "warrior's sword and ram's horn",
    "attributeDescription": "bronze sword raised high, shofar (ram's horn trumpet) at his side",
    "visualStyle": "ancient Israelite military commander, biblical warrior",
    "clothing": "ancient Israelite warrior attire: simple linen tunic, leather armor/breastplate, cloth head covering, sandals - NOT medieval armor, NOT chainmail",
    "physicalDescription": "strong warrior build, short dark beard, battle-hardened, fierce determined eyes, tanned weathered skin",
    "anatomyNote": "two arms only",
    "archetype": "The Conqueror, succeeded Moses, finished the mission"
  },
  "connection": {
    "thematic": "Both inherited impossible legacies and carved their own legendary paths",
    "narrative": "Moses got them to the edge. Joshua took the land. MJ built it. Kobe finished it.",
    "relationship": "The successor who proved worthy of the mantle",
    "scripture": "Joshua 1:1-9",
    "receipt": "5 titles; 81 points against Toronto in 2006"
  },
  "interactions": [
    {
      "id": "back-to-back",
      "description": "Back-to-back in warrior stances, both ready for battle"
    },
    {
      "id": "charge-forward",
      "description": "Both charging forward in attack, sword and ball raised"
    },
    {
      "id": "victory-pose",
      "description": "Arms raised in triumph, champions who conquered their promised land"
    }
  ],
  "defaultInteraction": "back-to-back",
  "cardVariants": [
    "thunder-lightning",
    "spx-spectrum",
    "chrome-refractor"
  ],
  "priority": 4,
  "status": "active"
}
