{
  "id": "curry-elijah",
  "series": "court-covenant",
  "type": "hero",
  "cardMode": "player-figure",
  "player": {
    "name": "Stephen Curry",
    "displayName": "Chef Curry",
    "poseFileId": "curry",
    "era": "2010s",
    "jerseyColors": {
      "primary": {
        "base": "blue",
        "accent": "gold"
      },
      "secondary": {
        "base": "gold",
        "accent": "blue"
      }
    },
    "signatureMoves": [
      "deep three-pointer",
      "behind-the-back dribble",
      "shimmy celebration"
    ],
    "physicalDescription": "lean athletic build, light skin, baby-faced with confident smile",
    "archetype": "The Revolutionary, changed the game forever, unlimited range"
  },
  "figure": {
    "name": "Elijah",
    "displayName": "Elijah",
    "poseFileId": "elijah",
    "attribute": "mantle of fire",
    "attributeDescription": "prophet's hairy mantle/cloak wreathed in divine flames, fire descending from heaven above",
    "visualStyle": "intense biblical prophet, wild and powerful",
    "clothing": "rough hairy mantle (prophet's cloak) made of animal hair, simple worn garments beneath, leather belt around waist",
    "physicalDescription": "weathered rugged appearance, wild untamed hair and long beard, piercing intense eyes that seem to burn with inner fire, lean and strong",
    "anatomyNote": "two arms only",
    "archetype": "The Fire Prophet, called down fire from heaven, changed everything"
  },
  "connection": {
    "thematic": "Both brought fire that changed everything - one from heaven, one from 35 feet",
    "narrative": "Elijah called down fire from the sky. Steph rains fire from the logo. Different era, same energy.",
    "relationship": "Revolutionary forces who made the impossible look routine",
    "scripture": "1 Kings 18:38",
    "receipt": "All-time leader in 3-pointers made; 4 titles"
  },
  "interactions": [
    {
      "id": "back-to-back",
      "description": "Back-to-back with fire and light swirling around them"
    },
    {
      "id": "fire-rain",
      "description": "Curry shooting, Elijah calling fire, flames falling from above"
    },
    {
      "id": "celebration",
      "description": "Both in triumphant poses, fire crackling, shimmy and prophecy fulfilled"
    }
  ],
  "defaultInteraction": "fire-rain",
  "cardVariants": [
    "thunder-lightning",
    "prizm-silver",
    "downtown"
  ],
  "priority": 5,
  "status": "active"
}
