{
  "id": "durant-jonathan",
  "series": "court-covenant",
  "type": "hero",
  "cardMode": "player-figure",
  "player": {
    "name": "Kevin Durant",
    "displayName": "KD",
    "poseFileId": "durant",
    "era": "2010s",
    "jerseyColors": {
      "primary": {
        "base": "blue",
        "accent": "gold"
      },
      "secondary": {
        "base": "white",
        "accent": "blue"
      }
    },
    "signatureMoves": [
      "pull-up jumper",
      "unstoppable scoring",
      "silky smooth shooting"
    ],
    "physicalDescription": "extremely tall 6'10\" with impossibly long arms and lean frame, slim build, short hair, facial hair, dark skin, effortless athletic grace",
    "archetype": "The Slim Reaper, pure scorer, complicated legacy and loyalties"
  },
  "figure": {
    "name": "Jonathan",
    "displayName": "Jonathan",
    "poseFileId": "jonathan",
    "attribute": "royal bow and arrows",
    "attributeDescription": "finely crafted bow of a prince and skilled archer, quiver of arrows, symbol of his warrior prowess",
    "visualStyle": "prince of Israel, beloved friend of David, noble warrior",
    "clothing": "prince's tunic of fine quality but practical for battle, light armor, royal but understated compared to his father Saul",
    "physicalDescription": "handsome noble young man, athletic warrior's build, kind loyal eyes, short dark hair and beard, olive skin, carries himself with quiet dignity",
    "anatomyNote": "two arms only",
    "archetype": "The Loyal Prince, elite warrior, chose friendship over throne"
  },
  "connection": {
    "thematic": "Both took the rival's side and paid for it at home",
    "narrative": "Jonathan sided with his father's rival. KD joined the team that beat him. Neither was ever fully forgiven at home.",
    "relationship": "Elite talents whose choice of the rival became their defining story",
    "scripture": "1 Samuel 18-20",
    "receipt": "Left OKC for Golden State in 2016; 2 titles, 2 Finals MVPs"
  },
  "interactions": [
    {
      "id": "side-by-side",
      "description": "Two elite talents standing together, complicated but capable"
    },
    {
      "id": "dap-up",
      "description": "Brotherhood between those who understand the weight of choices"
    }
  ],
  "defaultInteraction": "side-by-side",
  "cardVariants": [
    "thunder-lightning",
    "downtown"
  ],
  "priority": 12,
  "status": "active"
}
