{
  "id": "pippen-aaron",
  "series": "court-covenant",
  "type": "hero",
  "cardMode": "player-figure",
  "player": {
    "name": "Scottie Pippen",
    "displayName": "Pip",
    "poseFileId": "pippen",
    "era": "1990s",
    "jerseyColors": {
      "primary": {
        "base": "red",
        "accent": "white"
      },
      "secondary": {
        "base": "white",
        "accent": "red"
      }
    },
    "signatureMoves": [
      "coast-to-coast fast break",
      "perimeter defense",
      "outlet pass"
    ],
    "physicalDescription": "SCOTTIE PIPPEN LIKENESS: tall (6'8\") and lean athletic build, distinctive long face with prominent nose and chin, 1990s style high-top fade haircut, calm cool expression, dark skin",
    "archetype": "The Ultimate Sidekick, criminally underrated, two-way excellence"
  },
  "figure": {
    "name": "Aaron",
    "displayName": "Aaron",
    "poseFileId": "aaron",
    "attribute": "high priest vestments and staff",
    "attributeDescription": "golden staff of the high priest, elaborate breastplate with 12 precious stones representing the 12 tribes of Israel",
    "visualStyle": "dignified High Priest of Israel, biblical",
    "clothing": "HIGH PRIEST VESTMENTS: blue robe (me'il) with golden bells and pomegranates at hem, ephod (apron) of gold/blue/purple/scarlet with onyx shoulder stones, jeweled breastplate (choshen) with 12 gemstones in 4 rows, white linen turban with golden crown plate inscribed 'Holy to the Lord'",
    "physicalDescription": "tall dignified elderly man, long flowing white beard, wise serene expression",
    "anatomyNote": "two arms only, one may hold staff",
    "archetype": "The High Priest, Moses's essential partner, spoke for the leader"
  },
  "connection": {
    "thematic": "Both were the essential partners who made greatness possible, often overlooked",
    "narrative": "Scottie and Aaron: Elite support, criminally underrated. Some things never change.",
    "relationship": "The indispensable right-hand who made the leader complete",
    "scripture": {
      "ref": "Exodus 17:12",
      "hebrew": "וִידֵי מֹשֶׁה כְּבֵדִים וַיִּקְחוּ־אֶבֶן וַיָּשִׂימוּ תַחְתָּיו וַיֵּשֶׁב עָלֶיהָ וְאַהֲרֹן וְחוּר תָּמְכוּ בְיָדָיו מִזֶּה אֶחָד וּמִזֶּה אֶחָד וַיְהִי יָדָיו אֱמוּנָה עַד־בֹּא הַשָּׁמֶשׁ׃",
      "english": "But Moses’ hands were heavy; and they took a stone, and put it under him, and he sat thereon; and Aaron and Hur stayed up his hands, the one on the one side, and the other on the other side; and his hands were steady until the going down of the sun."
    },
    "receipt": "6 titles alongside MJ; named one of the 50 Greatest Players"
  },
  "interactions": [
    {
      "id": "back-to-back",
      "description": "Back-to-back with their leaders' silhouettes in the background"
    },
    {
      "id": "assist-pose",
      "description": "Pippen passing, Aaron gesturing to speak, both in service"
    },
    {
      "id": "side-by-side",
      "description": "Standing together as equals, finally getting their due"
    }
  ],
  "defaultInteraction": "back-to-back",
  "cardVariants": [
    "thunder-lightning",
    "beam-team",
    "metal-universe"
  ],
  "priority": 3,
  "status": "active"
}
