{
  "id": "lebron-david",
  "series": "court-covenant",
  "type": "hero",
  "cardMode": "player-figure",
  "player": {
    "name": "LeBron James",
    "displayName": "King James",
    "poseFileId": "lebron",
    "era": "2010s",
    "jerseyColors": {
      "primary": {
        "base": "purple",
        "accent": "gold"
      },
      "secondary": {
        "base": "gold",
        "accent": "purple"
      }
    },
    "signatureMoves": [
      "chase-down block",
      "tomahawk dunk",
      "no-look pass"
    ],
    "physicalDescription": "powerful muscular build, receding hairline, intense determined expression, wearing a golden basketball crown",
    "archetype": "The King, versatile greatness, longevity personified"
  },
  "figure": {
    "name": "King David",
    "displayName": "King David",
    "poseFileId": "david",
    "attribute": "golden crown (worn) and sling",
    "attributeDescription": "wearing simple golden crown of ancient Israel on his head, leather shepherd's sling with smooth river stones",
    "visualStyle": "biblical warrior-king, ancient Israelite royalty",
    "clothing": "royal robes in purple and blue over simple tunic, ancient Israelite style NOT medieval",
    "physicalDescription": "young and handsome, RUDDY complexion with reddish hair (as described in 1 Samuel 16:12), beautiful eyes, strong shepherd's build",
    "anatomyNote": "two arms only",
    "archetype": "The Shepherd King, rose from nothing to greatest ruler"
  },
  "connection": {
    "thematic": "Both rose from humble beginnings to become the undisputed king of their domain",
    "narrative": "From Akron to the throne. From shepherd to king. Built different.",
    "relationship": "Self-made kings who earned their crowns",
    "scripture": {
      "ref": "1 Samuel 16:13",
      "hebrew": "וַיִּקַּח שְׁמוּאֵל אֶת־קֶרֶן הַשֶּׁמֶן וַיִּמְשַׁח אֹתוֹ בְּקֶרֶב אֶחָיו וַתִּצְלַח רוּחַ־יְהוָה אֶל־דָּוִד מֵהַיּוֹם הַהוּא וָמָעְלָה וַיָּקָם שְׁמוּאֵל וַיֵּלֶךְ הָרָמָתָה׃",
      "english": "Then Samuel took the horn of oil, and anointed him in the midst of his brethren; and the spirit of the LORD came mightily upon David from that day forward. So Samuel rose up, and went to Ramah."
    },
    "receipt": "4 titles; NBA all-time leading scorer"
  },
  "interactions": [
    {
      "id": "back-to-back",
      "description": "Standing back-to-back in regal poses, both wearing crowns of their domain"
    },
    {
      "id": "throne-room",
      "description": "Both seated on thrones, scepters crossed, dual kings"
    },
    {
      "id": "warrior-stance",
      "description": "Battle-ready poses, David with sling, LeBron in defensive stance"
    }
  ],
  "defaultInteraction": "back-to-back",
  "cardVariants": [
    "thunder-lightning",
    "prizm-silver",
    "select-courtside"
  ],
  "priority": 2,
  "status": "active"
}
